variant,cansAvailable,name,salePrice,type,abv,glass,price,cans,case,halfCase,description,upc,glutenFree,image,untappd,hops
levenator,TRUE,Levenator,,Doppelbock,7.8,lager,8,17,90,50,"Rich malt flavor with notes of toasted caramel, dark fruit, and chocolate.",850051366095,FALSE,TRUE,,
espressar,TRUE,Espressar,,Coffee Porter,6.9,lager,7,17,90,50,"Served on Nitro. Biscuity, toasty, caramel, coffee, and vanilla. Conditioned on Peruvian coffee beans.",850051366200,FALSE,TRUE,,
prismatic,TRUE,Prismatic,,India Pale Ale,7,teku,8,18,95,50,"Pineapple, vanilla, tangerine, melon.",850051366064,FALSE,TRUE,,"El Dorado®, Idaho 7™, Strata®"
tides,TRUE,Tides,,India Pale Ale,7,teku,8,18,95,50,"Mango, passionfruit, and fruit stripe gum.",860009737600,FALSE,TRUE,5142237,"El Dorado®, Simcoe®, Mosaic®, Citra®"
firnara,TRUE,Firnara,,West Coast IPA,7.5,teku,8,18,95,50,"Orange, lemon zest, dank, piney and resinous.",850051366194,FALSE,TRUE,,"Centennial, Simcoe®, Amarillo®"
lupula,TRUE,Lupula,,India Pale Ale,7,teku,8,18,95,50,"Pineapple, mango, and grapefruit. Aromatic.",860009737617,FALSE,TRUE,5370332,"Motueka™, Moutere™, Riwaka™"
,FALSE,,,,,,,,,,,,,,,
tros,TRUE,Tros,,Double IPA,8,small-teku,8,22,120,65,"Pineapple, mandarin orange and mango.",850051366132,FALSE,TRUE,,"Mosaic®, Enigma®, Eureka!™"
orban,TRUE,Orban,,Imperial Stout,10.5,small-teku,9,24,130,70,"Caramel, orange, dark chocolate and vanilla. Conditioned on cracked Madagascar vanilla beans and Cocoa nibs.",850051366163,FALSE,TRUE,,