variant,halfs,sixtels,cases,tank,upc,style,product,wholesaleHalf,wholesaleSixtel,wholesaleCase,suggRetailHalf,suggRetailSixtel,suggRetailCase,has-image,description,hops
double-lupula,,,,15.5,850051366170,Double IPA,Double Lupula,$210,$88,$62,$300,$125,$89,TRUE,"Second revision. More hops, more malt, more everything. Everything Lupula is and more.","Motueka™, Moutere™, Riwaka™"
lupula,,,13,18,860009737617,India Pale Ale,Lupula,$168,$70,$55,$240,$100,$79,TRUE,"Pineapple, mango, and grapefruit. Aromatic.","Motueka™, Moutere™, Riwaka™"
hanno,,,,17.5,850051366064,India Pale Ale,Hanno,$168,$70,$55,$240,$100,$79,TRUE,"Resinous, dank, notes of douglas fir with citrus and lychee.","Mosaic®, Comet, Triumph"
solem,6,,,,,Imperial Saison,Solem,$168,$70,$59,$240,$100,$84,FALSE,"Funky and dry. Pineapple, leather, and ripe peach.",
Rein,,,,19.5,850051366040,Helles Lager,Rein,$126,$62,$46,$180,$89,$65,TRUE,Refreshing smooth malt backbone with fruit notes and floral aroma. ,Callista
faust,,,,16,,Wild Ale conditioned on Plums,Faust,$315,$123,$140,$450,$175,$200,FALSE,"Slightly sour, dry and oaky. Aged in oak foeders on our house microflora and conditioned on fresh plums.",
rubico,,,,,850051366156,Double IPA,Rubico,$210,$88,$62,$300,$125,$89,TRUE,"Pineapple, peach rings, bubblegum, strawberry and citrus.","Estate Grown Comet, Vic Secret™, Galaxy®"
orban,,,,,850051366163,Imperial Stout,Orban,$323,$112,$75,$462,$160,$107,TRUE,"Caramel, orange, dark chocolate and vanilla. Conditioned on cracked Madagascar vanilla beans and Cocoa nibs.",
prismatic,,,,,850051366064,India Pale Ale,Prismatic,$168,$70,$55,$240,$100,$79,,"Pineapple, vanilla, tangerine, melon.","El Dorado®, Idaho 7™, Strata®"
tides,,,2,,860009737600,India Pale Ale,Tides,$168,$70,$55,$240,$100,$79,,"Mango, passionfruit, and fruit stripe gum.","El Dorado®, Simcoe®, Mosaic®, Citra®"
firnara,,,,,850051366194,West Coast IPA,Firnara,$168,$70,$55,$240,$100,$79,,"Orange, lemon zest, dank, piney and resinous.","Centennial, Simcoe®, Amarillo®"
vespero,2,,,,850051366187,Czech Dark Lager,Vespero,$126,$63,$46,$180,$90,$65,,"Roasted chestnut, chocolate and raisin. Ruby hue and a hint of noble hops.",
espressar,,,9,,850051366200,Coffee Porter,Espressar,$154,$60,$53,$220,$85,$75,,"Biscuity, toasty, caramel, coffee, and vanilla. Conditioned on Peruvian coffee beans.",
tros,,,14,,850051366132,Double IPA,Tros,$210,$88,$62,$300,$125,$89,,"Pineapple, mandarin orange and mango.","Mosaic®, Enigma®, Eureka!™"