variant,halfs,sixtels,cases,tank,upc,style,product,wholesaleHalf,wholesaleSixtel,wholesaleCase,suggRetailHalf,suggRetailSixtel,suggRetailCase,has-image,description,hops
double-lupula,,,17,,850051366170,Double IPA,Double Lupula,$210,$88,$62,$300,$125,$89,TRUE,"Second revision. More hops, more malt, more everything. Everything Lupula is and more.","Motueka™, Moutere™, Riwaka™"
lupula,,,,,860009737617,India Pale Ale,Lupula,$168,$70,$55,$240,$100,$79,TRUE,"Pineapple, mango, and grapefruit. Aromatic.","Motueka™, Moutere™, Riwaka™"
hanno,,,12,,850051366064,India Pale Ale,Hanno,$168,$70,$55,$240,$100,$79,TRUE,"Resinous, douglas fir with citrus and lychee.","Mosaic®, Comet, Triumph"
stark,2,,,20.5,860009737631,Heller Bock Lager,Stark,,,,,,,TRUE,Rich maltiness with caramel and toast. Spice with floral aroma.,Hallertauer Tradition
Rein,,,27,7,850051366040,Helles Lager,Rein,$126,$62,$46,$180,$89,$65,TRUE,Refreshing smooth malt backbone with fruit notes and floral aroma. ,Callista
espressar,,,5,,850051366200,Coffee Porter,Espressar,$154,$60,$53,$220,$85,$75,TRUE,"Biscuity, toasty, caramel, coffee, and vanilla. Conditioned on Peruvian coffee beans.",Helios™
tros,,,5,,850051366132,Double IPA,Tros,$210,$88,$62,$300,$125,$89,TRUE,"Pineapple, mandarin orange and mango.","Mosaic®, Enigma®, Eureka!™"
faust,,,,,,Wild Ale conditioned on Plums,Faust,$315,$123,$140,$450,$175,$200,FALSE,"Slightly sour, dry and oaky. Aged in oak foeders on our house microflora and conditioned on fresh plums.",
hurron,,,10,,850051366132,Double IPA,Hurron,$210,$88,$62,$300,$125,$89,,"Enhanced with thiol-enriched Motueka from Freestyle Hops x Phantasm. Peach, pineapple and white grape. ","Mega Motueka, Citra®, Riwaka™, Moutere™"