"tap","variant","singleCanAvailable","name","type","abv","glass","price","description","image","hops"
"1","taupo","FALSE","Taupō","India Pale Ale","7","pint","7","Tropical passion fruit, red grapefruit, and zested orange.","TRUE","Riwaka™, Wakatu™, Citra®"
"2","domboc","FALSE","Dōmbōc","Baltic Porter","8","pint","7","Chocolate, caramel, dark fruit with a malty sweetness with full body.","TRUE","Saaz"
"3","glyphs","FALSE","Glyphs","Pale Ale","5","pint","7","Tangerine, orange zest, and aromatic pine.","TRUE","Calypso™, Strata®, Chinook"
"4","lupula","FALSE","Lupula","India Pale Ale","7","pint","7","Pineapple, mango, and grapefruit. Aromatic.","TRUE","Motueka™, Moutere™, Riwaka™"
"5","jantar","FALSE","Jantar","Czech Amber Lager","4.7","stein","6","Medium bodied lager with rich caramel sweetness, toast with a smooth, spicy finish.","TRUE","Saaz"
"6","grandar","FALSE","Grandar","Imperial Pilsner","6.6","stein","7","Crackery sweetness balanced with hops, floral and herbal notes that finish with a subtle citrus. Step mashed and hopped with nobles.","TRUE","Hallertau Mittelfrüh, Saaz"
"7","gosev","FALSE","Gosev","Gose","4.5","teku","7","Tart ale with notes of lemon, lime, sea salt and coriander. Lightly conditioned on Raspberries.","TRUE",""
"8","priscus","FALSE","Priscus","Double IPA","8.6","pint","10","Sauvignon blanc, blueberry and citrus. ","TRUE",""
"9","faust","FALSE","Faust","Wild Ale conditioned on Plums","9.3","teku","9","Slightly sour, dry and oaky. Aged in oak foeders on our house microflora and conditioned on fresh plums.","FALSE",""
"10","verus","FALSE","Verus","India Pale Ale","7","pint","7","Tropical fruit notes balanced with pear, melon, blueberry and citrus.","TRUE","Erebus™, Calypso™, Citra®"